{
  "$defs": {
    "AssessmentStatus": {
      "enum": [
        "PASS",
        "FAIL",
        "NOT_APPLICABLE",
        "MANUAL_REVIEW",
        "ERROR",
        "NOT_ASSESSED"
      ],
      "title": "AssessmentStatus",
      "type": "string"
    },
    "EvidenceRef": {
      "additionalProperties": false,
      "properties": {
        "collected_at": {
          "pattern": "^\\d{4}-\\d{2}-\\d{2}T\\d{2}:\\d{2}:\\d{2}(\\.\\d+)?Z$",
          "title": "Collected At",
          "type": "string"
        },
        "encrypted_artifact_location": {
          "pattern": "^private://[a-z0-9-]+/[a-zA-Z0-9/_-]+$",
          "title": "Encrypted Artifact Location",
          "type": "string"
        },
        "evidence_id": {
          "format": "uuid",
          "title": "Evidence Id",
          "type": "string"
        },
        "sha256": {
          "pattern": "^[a-f0-9]{64}$",
          "title": "Sha256",
          "type": "string"
        },
        "source_identity": {
          "maxLength": 4096,
          "minLength": 1,
          "title": "Source Identity",
          "type": "string"
        }
      },
      "required": [
        "evidence_id",
        "sha256",
        "source_identity",
        "encrypted_artifact_location",
        "collected_at"
      ],
      "title": "EvidenceRef",
      "type": "object"
    },
    "ServiceCheck": {
      "additionalProperties": false,
      "properties": {
        "evidence_refs": {
          "items": {
            "$ref": "#/$defs/EvidenceRef"
          },
          "title": "Evidence Refs",
          "type": "array"
        },
        "safety_contract_id": {
          "format": "uuid",
          "title": "Safety Contract Id",
          "type": "string"
        },
        "status": {
          "enum": [
            "PASS",
            "FAIL",
            "ERROR",
            "NOT_ASSESSED"
          ],
          "title": "Status",
          "type": "string"
        }
      },
      "required": [
        "safety_contract_id",
        "status",
        "evidence_refs"
      ],
      "title": "ServiceCheck",
      "type": "object"
    }
  },
  "$schema": "https://json-schema.org/draft/2020-12/schema",
  "additionalProperties": false,
  "properties": {
    "change_id": {
      "format": "uuid",
      "title": "Change Id",
      "type": "string"
    },
    "control_statuses": {
      "items": {
        "$ref": "#/$defs/AssessmentStatus"
      },
      "minItems": 1,
      "title": "Control Statuses",
      "type": "array"
    },
    "evidence_refs": {
      "items": {
        "$ref": "#/$defs/EvidenceRef"
      },
      "title": "Evidence Refs",
      "type": "array"
    },
    "org_id": {
      "format": "uuid",
      "title": "Org Id",
      "type": "string"
    },
    "post_scan_id": {
      "format": "uuid",
      "title": "Post Scan Id",
      "type": "string"
    },
    "schema_version": {
      "const": "1.0.0",
      "title": "Schema Version",
      "type": "string"
    },
    "service_checks": {
      "items": {
        "$ref": "#/$defs/ServiceCheck"
      },
      "minItems": 1,
      "title": "Service Checks",
      "type": "array"
    },
    "status": {
      "enum": [
        "VERIFIED",
        "FAILED",
        "NOT_FULLY_VERIFIED"
      ],
      "title": "Status",
      "type": "string"
    },
    "verification_id": {
      "format": "uuid",
      "title": "Verification Id",
      "type": "string"
    },
    "verified_at": {
      "pattern": "^\\d{4}-\\d{2}-\\d{2}T\\d{2}:\\d{2}:\\d{2}(\\.\\d+)?Z$",
      "title": "Verified At",
      "type": "string"
    }
  },
  "required": [
    "schema_version",
    "org_id",
    "verification_id",
    "change_id",
    "post_scan_id",
    "control_statuses",
    "service_checks",
    "status",
    "verified_at",
    "evidence_refs"
  ],
  "title": "Verification",
  "type": "object"
}
